<?xml version="1.0" encoding="utf-8"?>

<!--
Copyright (c) 2006-2010 Apple Inc. All rights reserved.

Licensed under the Apache License, Version 2.0 (the "License");
you may not use this file except in compliance with the License.
You may obtain a copy of the License at

    http://www.apache.org/licenses/LICENSE-2.0

Unless required by applicable law or agreed to in writing, software
distributed under the License is distributed on an "AS IS" BASIS,
WITHOUT WARRANTIES OR CONDITIONS OF ANY KIND, either express or implied.
See the License for the specific language governing permissions and
limitations under the License.
 -->

<!DOCTYPE accounts SYSTEM "accounts.dtd">

<accounts realm="Test Realm">
  <user>
    <uid>admin</uid>
    <guid>admin</guid>
    <password>admin</password>
    <name>Super User</name>
    <first-name>Super</first-name>
    <last-name>User</last-name>
  </user>
  <user>
    <uid>apprentice</uid>
    <guid>apprentice</guid>
    <password>apprentice</password>
    <name>Apprentice Super User</name>
    <first-name>Apprentice</first-name>
    <last-name>Super User</last-name>
  </user>
  <user>
    <uid>wsanchez</uid>
    <guid>wsanchez</guid>
    <email-address>wsanchez@apple.com</email-address>
    <password>test</password>
    <name>Wilfredo Sanchez Vega</name>
    <first-name>Wilfredo</first-name>
    <last-name>Sanchez Vega</last-name>
  </user>
  <user>
    <uid>cdaboo</uid>
    <guid>cdaboo</guid>
    <email-address>cdaboo@apple.com</email-address>
    <password>test</password>
    <name>Cyrus Daboo</name>
    <first-name>Cyrus</first-name>
    <last-name>Daboo</last-name>
  </user>
  <user>
    <uid>sagen</uid>
    <guid>sagen</guid>
    <email-address>sagen@apple.com</email-address>
    <password>test</password>
    <name>Morgen Sagen</name>
    <first-name>Morgen</first-name>
    <last-name>Sagen</last-name>
  </user>
  <user>
    <uid>dre</uid>
    <guid>andre</guid>
    <email-address>dre@apple.com</email-address>
    <password>test</password>
    <name>Andre LaBranche</name>
    <first-name>Andre</first-name>
    <last-name>LaBranche</last-name>
  </user>
  <user>
    <uid>glyph</uid>
    <guid>glyph</guid>
    <email-address>glyph@apple.com</email-address>
    <password>test</password>
    <name>Glyph Lefkowitz</name>
    <first-name>Glyph</first-name>
    <last-name>Lefkowitz</last-name>
  </user>
  <user repeat="99">
    <uid>user%02d</uid>
    <uid>User %02d</uid>
    <guid>user%02d</guid>
    <password>user%02d</password>
    <name>User %02d</name>
    <first-name>User</first-name>
    <last-name>%02d</last-name>
    <email-address>user%02d@example.com</email-address>
  </user>
  <user repeat="10">
    <uid>public%02d</uid>
    <guid>public%02d</guid>
    <password>public%02d</password>
    <name>Public %02d</name>
    <first-name>Public</first-name>
    <last-name>%02d</last-name>
  </user>
  <group>
    <uid>group01</uid>
    <guid>group01</guid>
    <password>group01</password>
    <name>Group 01</name>
    <members>
      <member type="users">user01</member>
    </members>
  </group>
  <group>
    <uid>group02</uid>
    <guid>group02</guid>
    <password>group02</password>
    <name>Group 02</name>
    <members>
      <member type="users">user06</member>
      <member type="users">user07</member>
    </members>
  </group>
  <group>
    <uid>group03</uid>
    <guid>group03</guid>
    <password>group03</password>
    <name>Group 03</name>
    <members>
      <member type="users">user08</member>
      <member type="users">user09</member>
    </members>
  </group>
  <group>
    <uid>group04</uid>
    <guid>group04</guid>
    <password>group04</password>
    <name>Group 04</name>
    <members>
      <member type="groups">group02</member>
      <member type="groups">group03</member>
      <member type="users">user10</member>
    </members>
  </group>
  <group>
    <uid>disabledgroup</uid>
    <guid>disabledgroup</guid>
    <password>disabledgroup</password>
    <name>Disabled Group</name>
    <members>
      <member type="users">user01</member>
    </members>
  </group>
  <location>
    <uid>mercury</uid>
    <guid>mercury</guid>
    <password>test</password>
    <name>Mecury Conference Room, Building 1, 2nd Floor</name>
  </location>
  <location>
    <uid>venus</uid>
    <guid>venus</guid>
    <password>test</password>
    <name>Venus Conference Room, Building 1, 2nd Floor</name>
  </location>
  <location>
    <uid>Earth</uid>
    <guid>Earth</guid>
    <password>test</password>
    <name>Earth Conference Room, Building 1, 1st Floor</name>
  </location>
  <location>
    <uid>mars</uid>
    <guid>mars</guid>
    <password>test</password>
    <name>Mars Conference Room, Building 1, 1st Floor</name>
  </location>
  <location>
    <uid>jupiter</uid>
    <guid>jupiter</guid>
    <password>test</password>
    <name>Jupiter Conference Room, Building 2, 1st Floor</name>
  </location>
  <location>
    <uid>neptune</uid>
    <guid>neptune</guid>
    <password>test</password>
    <name>Neptune Conference Room, Building 2, 1st Floor</name>
  </location>
  <location>
    <uid>pluto</uid>
    <guid>pluto</guid>
    <password>test</password>
    <name>Pluto Conference Room, Building 2, 1st Floor</name>
  </location>
  <location>
    <uid>saturn</uid>
    <guid>saturn</guid>
    <password>test</password>
    <name>Saturn Conference Room, Building 2, 1st Floor</name>
  </location>
  <location>
    <uid>uranus</uid>
    <guid>uranus</guid>
    <password>test</password>
    <name>Uranus Conference Room, Building 3, 1st Floor</name>
  </location>
</accounts>
