<?xml version="1.0" encoding="utf-8"?>

<!--
Copyright (c) 2006 Apple Computer, Inc. All rights reserved.

Licensed under the Apache License, Version 2.0 (the "License");
you may not use this file except in compliance with the License.
You may obtain a copy of the License at

    http://www.apache.org/licenses/LICENSE-2.0

Unless required by applicable law or agreed to in writing, software
distributed under the License is distributed on an "AS IS" BASIS,
WITHOUT WARRANTIES OR CONDITIONS OF ANY KIND, either express or implied.
See the License for the specific language governing permissions and
limitations under the License.
 -->

<!DOCTYPE accounts SYSTEM "accounts.dtd">

<accounts realm="Test Realm">
  <user>
    <uid>admin</uid>
    <password>admin</password>
    <name>Super User</name>
  </user>
  <user>
    <uid>proxy</uid>
    <password>proxy</password>
    <name>User who can authorize as someone else</name>
    <canproxy/> <!-- FIXME: Is the directory the right place to configure this bit? -->
  </user>
  <user>
    <uid>test</uid>
    <password>test</password>
    <name>Test User</name>
    <cuaddr>mailto:testuser@example.com</cuaddr>
  </user>
  <group>
    <uid>users</uid>
    <password>users</password>
    <name>Users Group</name>
    <members>
      <member type="user">test</member>
    </members>
  </group>
  <resource>
    <uid>mercury</uid>
    <password>mercury</password>
    <name>Mecury Conference Room, Building 1, 2nd Floor</name>
  </resource>
</accounts>
