<?xml version="1.0" encoding="utf-8"?>

<!--
Copyright (c) 2006-2007 Apple Inc. All rights reserved.

Licensed under the Apache License, Version 2.0 (the "License");
you may not use this file except in compliance with the License.
You may obtain a copy of the License at

    http://www.apache.org/licenses/LICENSE-2.0

Unless required by applicable law or agreed to in writing, software
distributed under the License is distributed on an "AS IS" BASIS,
WITHOUT WARRANTIES OR CONDITIONS OF ANY KIND, either express or implied.
See the License for the specific language governing permissions and
limitations under the License.
 -->

<!DOCTYPE accounts SYSTEM "../../../conf/accounts.dtd">

<accounts realm="Test">
  <user>
    <uid>admin</uid>
    <guid>D11F03A0-97EA-48AF-9A6C-FAC7F3975766</guid>
    <password>nimda</password>
    <name>Administrators</name>
  </user>
  <user>
    <uid>wsanchez</uid>
    <guid>6423F94A-6B76-4A3A-815B-D52CFD77935D</guid>
    <password>zehcnasw</password>
    <name>Wilfredo Sanchez</name>
    <cuaddr>mailto:wsanchez@example.com</cuaddr>
  </user>
  <user>
    <uid>cdaboo</uid>
    <guid>5A985493-EE2C-4665-94CF-4DFEA3A89500</guid>
    <password>oobadc</password>
    <name>Cyrus Daboo</name>
    <cuaddr>mailto:cdaboo@example.com</cuaddr>
  </user>
  <user>
    <uid>lecroy</uid>
    <guid>8B4288F6-CC82-491D-8EF9-642EF4F3E7D0</guid>
    <password>yorcel</password>
    <name>Chris Lecroy</name>
    <cuaddr>mailto:lecroy@example.com</cuaddr>
  </user>
  <user>
    <uid>dreid</uid>
    <guid>5FF60DAD-0BDE-4508-8C77-15F0CA5C8DD1</guid>
    <password>dierd</password>
    <name>David Reid</name>
    <cuaddr>mailto:dreid@example.com</cuaddr>
  </user>
  <user repeat="2">
    <uid>user%02d</uid>
    <password>%02duser</password>
    <name>User %02d</name>
  </user>
  <group>
    <uid>managers</uid>
    <password>managers</password>
    <name>Managers</name>
    <members>
      <member type="users">lecroy</member>
    </members>
  </group>
  <group>
    <uid>admin</uid>
    <password>admin</password>
    <name>Administrators</name>
    <members>
      <member type="groups">managers</member>
    </members>
  </group>
  <group>
    <uid>grunts</uid>
    <password>grunts</password>
    <name>We do all the work</name>
    <members>
      <member>wsanchez</member>
      <member>cdaboo</member>
      <member>dreid</member>
    </members>
  </group>
  <group>
    <uid>right_coast</uid>
    <password>right_coast</password>
    <name>East Coast</name>
    <members>
      <member>cdaboo</member>
    </members>
  </group>
  <group>
    <uid>left_coast</uid>
    <password>left_coast</password>
    <name>West Coast</name>
    <members>
      <member>wsanchez</member>
      <member>lecroy</member>
      <member>dreid</member>
    </members>
  </group>
  <group>
    <uid>both_coasts</uid>
    <password>both_coasts</password>
    <name>Both Coasts</name>
    <members>
      <member type="groups">right_coast</member>
      <member type="groups">left_coast</member>
    </members>
  </group>
  <group>
    <uid>recursive1_coasts</uid>
    <password>recursive1_coasts</password>
    <name>Recursive1 Coasts</name>
    <members>
      <member type="groups">recursive2_coasts</member>
      <member>wsanchez</member>
    </members>
  </group>
  <group>
    <uid>recursive2_coasts</uid>
    <password>recursive2_coasts</password>
    <name>Recursive2 Coasts</name>
    <members>
      <member type="groups">recursive1_coasts</member>
      <member>cdaboo</member>
    </members>
  </group>
  <group>
    <uid>non_calendar_group</uid>
    <password>non_calendar_group</password>
    <name>Non-calendar group</name>
    <members>
      <member>cdaboo</member>
      <member>lecroy</member>
    </members>
    <disable-calendar/>
  </group>
  <location>
    <uid>mercury</uid>
    <password>mercury</password>
    <name>Mecury Seven</name>
    <cuaddr>mailto:mercury@example.com</cuaddr>
    <proxies>
      <member type="groups">left_coast</member>
    </proxies>
  </location>
  <location>
    <uid>gemini</uid>
    <password>gemini</password>
    <name>Gemini Twelve</name>
    <cuaddr>mailto:gemini@example.com</cuaddr>
    <auto-schedule/>
    <proxies>
      <member>wsanchez</member>
    </proxies>
  </location>
  <location>
    <uid>apollo</uid>
    <password>apollo</password>
    <name>Apollo Eleven</name>
    <cuaddr>mailto:apollo@example.com</cuaddr>
    <proxies>
      <member type="groups">both_coasts</member>
    </proxies>
  </location>
  <location>
    <uid>orion</uid>
    <password>orion</password>
    <name>Orion</name>
    <cuaddr>mailto:orion@example.com</cuaddr>
    <proxies>
      <member type="groups">recursive1_coasts</member>
    </proxies>
  </location>
  <resource>
    <uid>transporter</uid>
    <password>transporter</password>
    <name>Mass Transporter</name>
    <cuaddr>mailto:transporter@example.com</cuaddr>
  </resource>
  <resource>
    <uid>ftlcpu</uid>
    <password>ftlcpu</password>
    <name>Faster-Than-Light Microprocessor</name>
    <cuaddr>mailto:ftlcpu@example.com</cuaddr>
  </resource>
  <resource>
    <uid>non_calendar_proxy</uid>
    <guid>non_calendar_proxy</guid>
    <password>non_calendar_proxy</password>
    <name>Non-calendar proxy</name>
    <cuaddr>mailto:non_calendar_proxy@example.com</cuaddr>
    <proxies>
      <member type="groups">non_calendar_group</member>
    </proxies>
  </resource>
</accounts>
