<?xml version="1.0" encoding="utf-8"?>

<!--
Copyright (c) 2006-2013 Apple Inc. All rights reserved.

Licensed under the Apache License, Version 2.0 (the "License");
you may not use this file except in compliance with the License.
You may obtain a copy of the License at

    http://www.apache.org/licenses/LICENSE-2.0

Unless required by applicable law or agreed to in writing, software
distributed under the License is distributed on an "AS IS" BASIS,
WITHOUT WARRANTIES OR CONDITIONS OF ANY KIND, either express or implied.
See the License for the specific language governing permissions and
limitations under the License.
 -->

<!DOCTYPE accounts SYSTEM "../../../conf/auth/accounts.dtd">

<accounts realm="Test">
  <user>
    <uid>admin</uid>
    <guid>D11F03A0-97EA-48AF-9A6C-FAC7F3975766</guid>
    <password>nimda</password>
    <name>Administrators</name>
  </user>
  <user>
    <uid>wsanchez</uid>
    <guid>6423F94A-6B76-4A3A-815B-D52CFD77935D</guid>
    <password>zehcnasw</password>
    <name>Wilfredo Sanchez</name>
    <email-address>wsanchez@example.com</email-address>
  </user>
  <user>
    <uid>cdaboo</uid>
    <guid>5A985493-EE2C-4665-94CF-4DFEA3A89500</guid>
    <password>oobadc</password>
    <name>Cyrus Daboo</name>
    <email-address>cdaboo@example.com</email-address>
  </user>
  <user>
    <uid>lecroy</uid>
    <guid>8B4288F6-CC82-491D-8EF9-642EF4F3E7D0</guid>
    <password>yorcel</password>
    <name>Chris Lecroy</name>
    <email-address>lecroy@example.com</email-address>
  </user>
  <user>
    <uid>dreid</uid>
    <guid>5FF60DAD-0BDE-4508-8C77-15F0CA5C8DD1</guid>
    <password>dierd</password>
    <name>David Reid</name>
    <email-address>dreid@example.com</email-address>
  </user>
  <user>
    <uid>doublequotes</uid>
    <guid>8E04787E-336D-41ED-A70B-D233AD0DCE6F</guid>
    <password>setouqelbuod</password>
    <name>Double "quotey" Quotes</name>
    <email-address>doublequotes@example.com</email-address>
  </user>
  <user>
    <uid>nocalendar</uid>
    <guid>543D28BA-F74F-4D5F-9243-B3E3A61171E5</guid>
    <password>radnelacon</password>
    <name>No Calendar</name>
    <email-address>nocalendar@example.com</email-address>
  </user>
  <user>
    <uid>usera</uid>
    <guid>7423F94A-6B76-4A3A-815B-D52CFD77935D</guid>
    <password>a</password>
    <name>a</name>
    <email-address>a@example.com</email-address>
  </user>
  <user>
    <uid>userb</uid>
    <guid>8A985493-EE2C-4665-94CF-4DFEA3A89500</guid>
    <password>b</password>
    <name>b</name>
    <email-address>b@example.com</email-address>
  </user>
  <user>
    <uid>userc</uid>
    <guid>9FF60DAD-0BDE-4508-8C77-15F0CA5C8DD2</guid>
    <password>c</password>
    <name>c</name>
    <email-address>c@example.com</email-address>
  </user>
  <user>
    <uid>usercalonly</uid>
    <guid>9E1FFAC4-3CCD-45A1-8272-D161C92D2EEE</guid>
    <password>a</password>
    <name>a calonly</name>
    <email-address>a-calonly@example.com</email-address>
  </user>
  <user>
    <uid>useradbkonly</uid>
    <guid>7678EC8A-A069-4E82-9066-7279C6718507</guid>
    <password>a</password>
    <name>a adbkonly</name>
    <email-address>a-adbkonly@example.com</email-address>
  </user>
  <user>
    <uid>nonascii</uid>
    <uid>nonascii佐藤</uid>
    <guid>320B73A1-46E2-4180-9563-782DFDBE1F63</guid>
    <password>a</password>
    <name>佐藤佐藤佐藤</name>
    <email-address>nonascii@example.com</email-address>
  </user>
  <user>
    <uid>delegator</uid>
    <guid>FC465590-E9E9-4746-ACE8-6C756A49FE4D</guid>
    <password>a</password>
    <name>Calendar Delegator</name>
    <email-address>calendardelegator@example.com</email-address>
  </user>
  <user>
    <uid>occasionaldelegate</uid>
    <guid>EC465590-E9E9-4746-ACE8-6C756A49FE4D</guid>
    <password>a</password>
    <name>Occasional Delegate</name>
    <email-address>occasional@example.com</email-address>
  </user>
    <user>
    <uid>delegateviagroup</uid>
    <guid>46D9D716-CBEE-490F-907A-66FA6C3767FF</guid>
    <password>a</password>
    <name>Delegate Via Group</name>
    <email-address>delegateviagroup@example.com</email-address>
  </user>
  <group>
    <uid>delegategroup</uid>
    <guid>00599DAF-3E75-42DD-9DB7-52617E79943F</guid>
    <name>Delegate Group</name>
    <members>
      <member type="users">delegateviagroup</member>
    </members>
  </group>
  <user repeat="2">
    <uid>user%02d</uid>
    <guid>user%02d</guid>
    <password>%02duser</password>
    <name>~35 User %02d</name>
    <first-name>~5</first-name>
    <last-name>~9 User %02d</last-name>
    <email-address>~10@example.com</email-address>
  </user>
  <group>
    <uid>managers</uid>
    <guid>9FF60DAD-0BDE-4508-8C77-15F0CA5C8DD1</guid>
    <password>managers</password>
    <name>Managers</name>
    <members>
      <member type="users">lecroy</member>
    </members>
  </group>
  <group>
    <uid>admin</uid>
    <guid>admin</guid>
    <password>admin</password>
    <name>Administrators</name>
    <members>
      <member type="groups">managers</member>
    </members>
  </group>
  <group>
    <uid>grunts</uid>
    <guid>grunts</guid>
    <password>grunts</password>
    <name>We do all the work</name>
    <members>
      <member>wsanchez</member>
      <member>cdaboo</member>
      <member>dreid</member>
    </members>
  </group>
  <group>
    <uid>right_coast</uid>
    <guid>right_coast</guid>
    <password>right_coast</password>
    <name>East Coast</name>
    <members>
      <member>cdaboo</member>
    </members>
  </group>
  <group>
    <uid>left_coast</uid>
    <guid>left_coast</guid>
    <password>left_coast</password>
    <name>West Coast</name>
    <members>
      <member>wsanchez</member>
      <member>lecroy</member>
      <member>dreid</member>
    </members>
  </group>
  <group>
    <uid>both_coasts</uid>
    <guid>both_coasts</guid>
    <password>both_coasts</password>
    <name>Both Coasts</name>
    <members>
      <member type="groups">right_coast</member>
      <member type="groups">left_coast</member>
    </members>
  </group>
  <group>
    <uid>recursive1_coasts</uid>
    <guid>recursive1_coasts</guid>
    <password>recursive1_coasts</password>
    <name>Recursive1 Coasts</name>
    <members>
      <member type="groups">recursive2_coasts</member>
      <member>wsanchez</member>
    </members>
  </group>
  <group>
    <uid>recursive2_coasts</uid>
    <guid>recursive2_coasts</guid>
    <password>recursive2_coasts</password>
    <name>Recursive2 Coasts</name>
    <members>
      <member type="groups">recursive1_coasts</member>
      <member>cdaboo</member>
    </members>
  </group>
  <group>
    <uid>non_calendar_group</uid>
    <guid>non_calendar_group</guid>
    <password>non_calendar_group</password>
    <name>Non-calendar group</name>
    <members>
      <member>cdaboo</member>
      <member>lecroy</member>
    </members>
  </group>
  <location>
    <uid>mercury</uid>
    <guid>mercury</guid>
    <password>mercury</password>
    <name>Mercury Seven</name>
    <email-address>mercury@example.com</email-address>
  </location>
  <location>
    <uid>gemini</uid>
    <guid>gemini</guid>
    <password>gemini</password>
    <name>Gemini Twelve</name>
    <email-address>gemini@example.com</email-address>
  </location>
  <location>
    <uid>apollo</uid>
    <guid>apollo</guid>
    <password>apollo</password>
    <name>Apollo Eleven</name>
    <email-address>apollo@example.com</email-address>
  </location>
  <location>
    <uid>orion</uid>
    <guid>orion</guid>
    <password>orion</password>
    <name>Orion</name>
    <email-address>orion@example.com</email-address>
  </location>
  <resource>
    <uid>transporter</uid>
    <guid>transporter</guid>
    <password>transporter</password>
    <name>Mass Transporter</name>
    <email-address>transporter@example.com</email-address>
  </resource>
  <resource>
    <uid>ftlcpu</uid>
    <guid>ftlcpu</guid>
    <password>ftlcpu</password>
    <name>Faster-Than-Light Microprocessor</name>
    <email-address>ftlcpu@example.com</email-address>
  </resource>
  <resource>
    <uid>non_calendar_proxy</uid>
    <guid>non_calendar_proxy</guid>
    <password>non_calendar_proxy</password>
    <name>Non-calendar proxy</name>
    <email-address>non_calendar_proxy@example.com</email-address>
  </resource>
  <resource>
    <uid>disabled</uid>
    <guid>disabled</guid>
    <password>disabled</password>
    <name>Disabled Record</name>
    <email-address>disabled@example.com</email-address>
  </resource>
</accounts>
